[
  {
    "change_id": "chg-001",
    "source_system": "jenkins",
    "source_change_id": "jenkins-build-4521",
    "service_canonical_id": "ent:service:api-service",
    "environment": "production",
    "version": "2.14.0",
    "previous_version": "2.13.2",
    "timestamp_start": "2026-02-25T11:15:00Z",
    "timestamp_end": "2026-02-25T11:22:00Z",
    "actor": "deploy-bot",
    "pipeline": "api-service-deploy",
    "status": "succeeded",
    "commit_sha": "a1b2c3d4e5f6",
    "commit_message": "feat: increase connection pool timeout to 30s",
    "affected_entities": [
      "ent:service:api-service",
      "ent:pod:api-pod-1",
      "ent:database:postgres-primary"
    ],
    "metadata": {
      "jenkins_job": "api-service/main",
      "build_number": 4521,
      "deploy_strategy": "rolling"
    }
  },
  {
    "change_id": "chg-002",
    "source_system": "argocd",
    "source_change_id": "argocd-sync-789",
    "service_canonical_id": "ent:service:api-service",
    "environment": "production",
    "version": "2.14.0",
    "previous_version": "2.13.2",
    "timestamp_start": "2026-02-25T11:22:30Z",
    "timestamp_end": "2026-02-25T11:27:00Z",
    "actor": "argocd-controller",
    "pipeline": "api-service-k8s-sync",
    "status": "succeeded",
    "commit_sha": "a1b2c3d4e5f6",
    "commit_message": "feat: increase connection pool timeout to 30s",
    "affected_entities": [
      "ent:pod:api-pod-1",
      "ent:host:k8s-node-1"
    ],
    "metadata": {
      "argocd_app": "api-service",
      "sync_revision": "a1b2c3d4e5f6",
      "health_status": "healthy"
    }
  }
]
